{"eventTypes":[{"attributes":[{"name":"standing","type":"string"}],"name":"act"},{"attributes":[{"name":"standing","type":"string"}],"name":"materialize"},{"attributes":[{"name":"standing","type":"string"}],"name":"teardown"}],"events":[{"attributes":[{"name":"standing","value":"ALIVE"},{"name":"idempotency_key","value":"4618910af9d64495bf0d59468f8bc951"},{"name":"post_state_digest","value":"7dd6354d9d5b5db84c4168a1daa70887268860cd295b61de6a3410552a4cd71a"}],"id":"80a3bf76ad5641508a036d147c183ba2","relationships":[{"objectId":"2d9c35b49b2b4d4ea44c6df0e7832356","qualifier":"episode"},{"objectId":"urn:gymact:discovered:environment:0494ca5366a34def9b5309eff05f8b45","qualifier":"environment"},{"objectId":"urn:gymact:operation:materialize","qualifier":"capability"}],"time":"2026-08-07T21:01:34.966254+00:00","type":"materialize"},{"attributes":[{"name":"standing","value":"ALIVE"},{"name":"reason","value":"solved=False returncode=1"},{"name":"idempotency_key","value":"bf4cda73948f41ed83a27d4a88d4757f"},{"name":"pre_state_digest","value":"7dd6354d9d5b5db84c4168a1daa70887268860cd295b61de6a3410552a4cd71a"},{"name":"post_state_digest","value":"9070411612772d05ddfa2cf29226bd27df4860d80592eea312fb1f1840b72fd5"}],"id":"474ef30c4822473892d98e92ed76f15b","relationships":[{"objectId":"2d9c35b49b2b4d4ea44c6df0e7832356","qualifier":"episode"},{"objectId":"urn:gymact:discovered:environment:0494ca5366a34def9b5309eff05f8b45","qualifier":"environment"},{"objectId":"urn:gymact:discovered:capability:run","qualifier":"capability"}],"time":"2026-08-07T21:01:35.165545+00:00","type":"act"},{"attributes":[{"name":"standing","value":"ALIVE"},{"name":"pre_state_digest","value":"9070411612772d05ddfa2cf29226bd27df4860d80592eea312fb1f1840b72fd5"}],"id":"5357517b78a945528fc242fc4b5a72bd","relationships":[{"objectId":"2d9c35b49b2b4d4ea44c6df0e7832356","qualifier":"episode"},{"objectId":"urn:gymact:discovered:environment:0494ca5366a34def9b5309eff05f8b45","qualifier":"environment"},{"objectId":"urn:gymact:operation:teardown","qualifier":"capability"}],"time":"2026-08-07T21:01:35.166209+00:00","type":"teardown"}],"objectTypes":[{"attributes":[],"name":"episode"},{"attributes":[],"name":"environment"},{"attributes":[],"name":"capability"}],"objects":[{"attributes":[],"id":"2d9c35b49b2b4d4ea44c6df0e7832356","type":"episode"},{"attributes":[],"id":"urn:gymact:discovered:environment:0494ca5366a34def9b5309eff05f8b45","type":"environment"},{"attributes":[],"id":"urn:gymact:discovered:capability:run","type":"capability"},{"attributes":[],"id":"urn:gymact:operation:materialize","type":"capability"},{"attributes":[],"id":"urn:gymact:operation:teardown","type":"capability"}]}