{"eventTypes":[{"attributes":[{"name":"standing","type":"string"}],"name":"act"},{"attributes":[{"name":"standing","type":"string"}],"name":"materialize"},{"attributes":[{"name":"standing","type":"string"}],"name":"verify"},{"attributes":[{"name":"passed","type":"string"}],"name":"verify_goal_consequence"}],"events":[{"attributes":[{"name":"standing","value":"ALIVE"},{"name":"idempotency_key","value":"89b7d46584de465bb56c5728db3101d8"},{"name":"post_state_digest","value":"c12dd5d4b974c33d3a0c4ecf86d1de8074b0150c66882ee8e57517c11362f01c"}],"id":"16756948f6c847bdafa055a1237ce351","relationships":[{"objectId":"68e802bac96d4d3ba636d06be62eb46e","qualifier":"episode"},{"objectId":"urn:gymact:lock-and-key:environment:fdad7c7845f044cab0c465c977238dbb","qualifier":"environment"},{"objectId":"urn:gymact:operation:materialize","qualifier":"capability"}],"time":"2026-08-08T21:50:54.989186+00:00","type":"materialize"},{"attributes":[{"name":"standing","value":"ALIVE"},{"name":"authority_ref","value":"urn:autofde-lab:level4-crown-authority"},{"name":"idempotency_key","value":"53cb03aa235d459586c7b0225d548888"},{"name":"pre_state_digest","value":"c12dd5d4b974c33d3a0c4ecf86d1de8074b0150c66882ee8e57517c11362f01c"},{"name":"post_state_digest","value":"2274209427a8a8457470d1a2120afb76ee6c266f121ec4cef21424b19d9017f4"}],"id":"b8ab4b13665144a4a6888f6586369dbc","relationships":[{"objectId":"68e802bac96d4d3ba636d06be62eb46e","qualifier":"episode"},{"objectId":"urn:gymact:lock-and-key:environment:fdad7c7845f044cab0c465c977238dbb","qualifier":"environment"},{"objectId":"urn:gymact:lock-and-key:capability:force_latch","qualifier":"capability"}],"time":"2026-08-08T21:50:54.990209+00:00","type":"act"},{"attributes":[{"name":"standing","value":"ALIVE"},{"name":"authority_ref","value":"urn:autofde-lab:level4-crown-authority"},{"name":"idempotency_key","value":"53cb03aa235d459586c7b0225d548888"},{"name":"pre_state_digest","value":"c12dd5d4b974c33d3a0c4ecf86d1de8074b0150c66882ee8e57517c11362f01c"},{"name":"post_state_digest","value":"2274209427a8a8457470d1a2120afb76ee6c266f121ec4cef21424b19d9017f4"},{"name":"verification_id","value":"f7dd6e65c5144b2c8db3979e5666e430"}],"id":"924257d2d03a4638813a2ff461145738","relationships":[{"objectId":"68e802bac96d4d3ba636d06be62eb46e","qualifier":"episode"},{"objectId":"urn:gymact:lock-and-key:environment:fdad7c7845f044cab0c465c977238dbb","qualifier":"environment"},{"objectId":"urn:gymact:lock-and-key:capability:force_latch","qualifier":"capability"}],"time":"2026-08-08T21:50:54.990664+00:00","type":"verify"},{"attributes":[{"name":"standing","value":"ALIVE"},{"name":"authority_ref","value":"urn:autofde-lab:level4-crown-authority"},{"name":"idempotency_key","value":"7749439d9e4d4d10937d16feb650dbf3"},{"name":"pre_state_digest","value":"2274209427a8a8457470d1a2120afb76ee6c266f121ec4cef21424b19d9017f4"},{"name":"post_state_digest","value":"2274209427a8a8457470d1a2120afb76ee6c266f121ec4cef21424b19d9017f4"}],"id":"46e83cb4e32244bf92c5dd16cdac475e","relationships":[{"objectId":"68e802bac96d4d3ba636d06be62eb46e","qualifier":"episode"},{"objectId":"urn:gymact:lock-and-key:environment:fdad7c7845f044cab0c465c977238dbb","qualifier":"environment"},{"objectId":"urn:gymact:lock-and-key:capability:pick_key","qualifier":"capability"}],"time":"2026-08-08T21:50:54.991176+00:00","type":"act"},{"attributes":[{"name":"standing","value":"REFUSED"},{"name":"reason","value":"POSTCONDITION_FAILED"},{"name":"authority_ref","value":"urn:autofde-lab:level4-crown-authority"},{"name":"idempotency_key","value":"7749439d9e4d4d10937d16feb650dbf3"},{"name":"pre_state_digest","value":"2274209427a8a8457470d1a2120afb76ee6c266f121ec4cef21424b19d9017f4"},{"name":"post_state_digest","value":"2274209427a8a8457470d1a2120afb76ee6c266f121ec4cef21424b19d9017f4"},{"name":"verification_id","value":"f10246cdada64f3ca400228081c0e764"}],"id":"d2e95579fdaa45269688dd4dc0fe48ac","relationships":[{"objectId":"68e802bac96d4d3ba636d06be62eb46e","qualifier":"episode"},{"objectId":"urn:gymact:lock-and-key:environment:fdad7c7845f044cab0c465c977238dbb","qualifier":"environment"},{"objectId":"urn:gymact:lock-and-key:capability:pick_key","qualifier":"capability"}],"time":"2026-08-08T21:50:54.991552+00:00","type":"verify"},{"attributes":[{"name":"standing","value":"ALIVE"},{"name":"authority_ref","value":"urn:autofde-lab:level4-crown-authority"},{"name":"idempotency_key","value":"592d0ddab438420fa7fab3d8c430be92"},{"name":"pre_state_digest","value":"2274209427a8a8457470d1a2120afb76ee6c266f121ec4cef21424b19d9017f4"},{"name":"post_state_digest","value":"2274209427a8a8457470d1a2120afb76ee6c266f121ec4cef21424b19d9017f4"}],"id":"40bfc7e3c2e44bda8b94e7b4061cf169","relationships":[{"objectId":"68e802bac96d4d3ba636d06be62eb46e","qualifier":"episode"},{"objectId":"urn:gymact:lock-and-key:environment:fdad7c7845f044cab0c465c977238dbb","qualifier":"environment"},{"objectId":"urn:gymact:lock-and-key:capability:open_lock","qualifier":"capability"}],"time":"2026-08-08T21:50:54.992016+00:00","type":"act"},{"attributes":[{"name":"standing","value":"REFUSED"},{"name":"reason","value":"POSTCONDITION_FAILED"},{"name":"authority_ref","value":"urn:autofde-lab:level4-crown-authority"},{"name":"idempotency_key","value":"592d0ddab438420fa7fab3d8c430be92"},{"name":"pre_state_digest","value":"2274209427a8a8457470d1a2120afb76ee6c266f121ec4cef21424b19d9017f4"},{"name":"post_state_digest","value":"2274209427a8a8457470d1a2120afb76ee6c266f121ec4cef21424b19d9017f4"},{"name":"verification_id","value":"075077bd139e4b5c955ee0a0b11de1b4"}],"id":"7f51fd3389154726a8070ad7086723da","relationships":[{"objectId":"68e802bac96d4d3ba636d06be62eb46e","qualifier":"episode"},{"objectId":"urn:gymact:lock-and-key:environment:fdad7c7845f044cab0c465c977238dbb","qualifier":"environment"},{"objectId":"urn:gymact:lock-and-key:capability:open_lock","qualifier":"capability"}],"time":"2026-08-08T21:50:54.992360+00:00","type":"verify"},{"attributes":[{"name":"passed","value":"False"},{"name":"verification_id","value":"6b7fa251d5a0463d87fd8a67584b6eaf"},{"name":"state_digest","value":"2274209427a8a8457470d1a2120afb76ee6c266f121ec4cef21424b19d9017f4"},{"name":"expected_digest","value":"b3991d4ea84c8fa9c25e8df2aa0539175fd35f59f3376a802175915f877bf109"},{"name":"observed_digest","value":"431cdf63e3743587ca998d47d816767765621bfac015ab09e591b719a5a71ff2"}],"id":"goal-verification:6b7fa251d5a0463d87fd8a67584b6eaf","relationships":[{"objectId":"68e802bac96d4d3ba636d06be62eb46e","qualifier":"episode"}],"time":"2026-08-08T21:50:54.992799+00:00","type":"verify_goal_consequence"}],"objectTypes":[{"attributes":[],"name":"episode"},{"attributes":[],"name":"environment"},{"attributes":[],"name":"capability"}],"objects":[{"attributes":[],"id":"68e802bac96d4d3ba636d06be62eb46e","type":"episode"},{"attributes":[],"id":"urn:gymact:lock-and-key:environment:fdad7c7845f044cab0c465c977238dbb","type":"environment"},{"attributes":[],"id":"urn:gymact:lock-and-key:capability:force_latch","type":"capability"},{"attributes":[],"id":"urn:gymact:lock-and-key:capability:open_lock","type":"capability"},{"attributes":[],"id":"urn:gymact:lock-and-key:capability:pick_key","type":"capability"},{"attributes":[],"id":"urn:gymact:operation:materialize","type":"capability"}]}
