{"eventTypes":[{"attributes":[{"name":"standing","type":"string"}],"name":"act"},{"attributes":[{"name":"standing","type":"string"}],"name":"materialize"},{"attributes":[{"name":"standing","type":"string"}],"name":"verify"},{"attributes":[{"name":"passed","type":"string"}],"name":"verify_goal_consequence"}],"events":[{"attributes":[{"name":"standing","value":"ALIVE"},{"name":"idempotency_key","value":"77fb257725c04fdaa5ca7148f8e585e5"},{"name":"post_state_digest","value":"c12dd5d4b974c33d3a0c4ecf86d1de8074b0150c66882ee8e57517c11362f01c"}],"id":"74f7b24b797a4ae8b13e3d98db475bb9","relationships":[{"objectId":"dd0d7efce61942cabf77c155a4ed3e62","qualifier":"episode"},{"objectId":"urn:gymact:lock-and-key:environment:ad816edfcfba42368f090e340abdea32","qualifier":"environment"},{"objectId":"urn:gymact:operation:materialize","qualifier":"capability"}],"time":"2026-08-08T20:45:03.443292+00:00","type":"materialize"},{"attributes":[{"name":"standing","value":"ALIVE"},{"name":"authority_ref","value":"urn:autofde-lab:level4-crown-authority"},{"name":"idempotency_key","value":"c51aa5fee666474ea26c792ef174f9fb"},{"name":"pre_state_digest","value":"c12dd5d4b974c33d3a0c4ecf86d1de8074b0150c66882ee8e57517c11362f01c"},{"name":"post_state_digest","value":"2274209427a8a8457470d1a2120afb76ee6c266f121ec4cef21424b19d9017f4"}],"id":"cbb33c790a464dc9b573beaec8505c4c","relationships":[{"objectId":"dd0d7efce61942cabf77c155a4ed3e62","qualifier":"episode"},{"objectId":"urn:gymact:lock-and-key:environment:ad816edfcfba42368f090e340abdea32","qualifier":"environment"},{"objectId":"urn:gymact:lock-and-key:capability:force_latch","qualifier":"capability"}],"time":"2026-08-08T20:45:03.444110+00:00","type":"act"},{"attributes":[{"name":"standing","value":"ALIVE"},{"name":"authority_ref","value":"urn:autofde-lab:level4-crown-authority"},{"name":"idempotency_key","value":"c51aa5fee666474ea26c792ef174f9fb"},{"name":"pre_state_digest","value":"c12dd5d4b974c33d3a0c4ecf86d1de8074b0150c66882ee8e57517c11362f01c"},{"name":"post_state_digest","value":"2274209427a8a8457470d1a2120afb76ee6c266f121ec4cef21424b19d9017f4"},{"name":"verification_id","value":"cae513def3424137b9b0be70607f0c14"}],"id":"3b82f8b6bc694d47824ee321763c4f03","relationships":[{"objectId":"dd0d7efce61942cabf77c155a4ed3e62","qualifier":"episode"},{"objectId":"urn:gymact:lock-and-key:environment:ad816edfcfba42368f090e340abdea32","qualifier":"environment"},{"objectId":"urn:gymact:lock-and-key:capability:force_latch","qualifier":"capability"}],"time":"2026-08-08T20:45:03.444522+00:00","type":"verify"},{"attributes":[{"name":"standing","value":"ALIVE"},{"name":"authority_ref","value":"urn:autofde-lab:level4-crown-authority"},{"name":"idempotency_key","value":"3f834ff710f646fab39e3bb2e5892e84"},{"name":"pre_state_digest","value":"2274209427a8a8457470d1a2120afb76ee6c266f121ec4cef21424b19d9017f4"},{"name":"post_state_digest","value":"2274209427a8a8457470d1a2120afb76ee6c266f121ec4cef21424b19d9017f4"}],"id":"ec1b06ca750c4113833d7a28b2f9f676","relationships":[{"objectId":"dd0d7efce61942cabf77c155a4ed3e62","qualifier":"episode"},{"objectId":"urn:gymact:lock-and-key:environment:ad816edfcfba42368f090e340abdea32","qualifier":"environment"},{"objectId":"urn:gymact:lock-and-key:capability:pick_key","qualifier":"capability"}],"time":"2026-08-08T20:45:03.445004+00:00","type":"act"},{"attributes":[{"name":"standing","value":"REFUSED"},{"name":"reason","value":"POSTCONDITION_FAILED"},{"name":"authority_ref","value":"urn:autofde-lab:level4-crown-authority"},{"name":"idempotency_key","value":"3f834ff710f646fab39e3bb2e5892e84"},{"name":"pre_state_digest","value":"2274209427a8a8457470d1a2120afb76ee6c266f121ec4cef21424b19d9017f4"},{"name":"post_state_digest","value":"2274209427a8a8457470d1a2120afb76ee6c266f121ec4cef21424b19d9017f4"},{"name":"verification_id","value":"b1b10482dbba4f08a3ad7f3d95c4125c"}],"id":"3aedf171dcfa40b88dee5bf703d1cfec","relationships":[{"objectId":"dd0d7efce61942cabf77c155a4ed3e62","qualifier":"episode"},{"objectId":"urn:gymact:lock-and-key:environment:ad816edfcfba42368f090e340abdea32","qualifier":"environment"},{"objectId":"urn:gymact:lock-and-key:capability:pick_key","qualifier":"capability"}],"time":"2026-08-08T20:45:03.445362+00:00","type":"verify"},{"attributes":[{"name":"standing","value":"ALIVE"},{"name":"authority_ref","value":"urn:autofde-lab:level4-crown-authority"},{"name":"idempotency_key","value":"4bdd7ed626d54a159b4588ab17072c3b"},{"name":"pre_state_digest","value":"2274209427a8a8457470d1a2120afb76ee6c266f121ec4cef21424b19d9017f4"},{"name":"post_state_digest","value":"2274209427a8a8457470d1a2120afb76ee6c266f121ec4cef21424b19d9017f4"}],"id":"4e3a8b700b6c42c6acceac4901b50819","relationships":[{"objectId":"dd0d7efce61942cabf77c155a4ed3e62","qualifier":"episode"},{"objectId":"urn:gymact:lock-and-key:environment:ad816edfcfba42368f090e340abdea32","qualifier":"environment"},{"objectId":"urn:gymact:lock-and-key:capability:open_lock","qualifier":"capability"}],"time":"2026-08-08T20:45:03.445770+00:00","type":"act"},{"attributes":[{"name":"standing","value":"REFUSED"},{"name":"reason","value":"POSTCONDITION_FAILED"},{"name":"authority_ref","value":"urn:autofde-lab:level4-crown-authority"},{"name":"idempotency_key","value":"4bdd7ed626d54a159b4588ab17072c3b"},{"name":"pre_state_digest","value":"2274209427a8a8457470d1a2120afb76ee6c266f121ec4cef21424b19d9017f4"},{"name":"post_state_digest","value":"2274209427a8a8457470d1a2120afb76ee6c266f121ec4cef21424b19d9017f4"},{"name":"verification_id","value":"9cf0bd0e37e347e19481513a1337da3f"}],"id":"0f0ed63d40d546818478720eead80184","relationships":[{"objectId":"dd0d7efce61942cabf77c155a4ed3e62","qualifier":"episode"},{"objectId":"urn:gymact:lock-and-key:environment:ad816edfcfba42368f090e340abdea32","qualifier":"environment"},{"objectId":"urn:gymact:lock-and-key:capability:open_lock","qualifier":"capability"}],"time":"2026-08-08T20:45:03.446060+00:00","type":"verify"},{"attributes":[{"name":"passed","value":"False"},{"name":"verification_id","value":"715b53f25ee14c83aa92761ad5dc9257"},{"name":"state_digest","value":"2274209427a8a8457470d1a2120afb76ee6c266f121ec4cef21424b19d9017f4"},{"name":"expected_digest","value":"b3991d4ea84c8fa9c25e8df2aa0539175fd35f59f3376a802175915f877bf109"},{"name":"observed_digest","value":"431cdf63e3743587ca998d47d816767765621bfac015ab09e591b719a5a71ff2"}],"id":"goal-verification:715b53f25ee14c83aa92761ad5dc9257","relationships":[{"objectId":"dd0d7efce61942cabf77c155a4ed3e62","qualifier":"episode"}],"time":"2026-08-08T20:45:03.446447+00:00","type":"verify_goal_consequence"}],"objectTypes":[{"attributes":[],"name":"episode"},{"attributes":[],"name":"environment"},{"attributes":[],"name":"capability"}],"objects":[{"attributes":[],"id":"dd0d7efce61942cabf77c155a4ed3e62","type":"episode"},{"attributes":[],"id":"urn:gymact:lock-and-key:environment:ad816edfcfba42368f090e340abdea32","type":"environment"},{"attributes":[],"id":"urn:gymact:lock-and-key:capability:force_latch","type":"capability"},{"attributes":[],"id":"urn:gymact:lock-and-key:capability:open_lock","type":"capability"},{"attributes":[],"id":"urn:gymact:lock-and-key:capability:pick_key","type":"capability"},{"attributes":[],"id":"urn:gymact:operation:materialize","type":"capability"}]}
