{
  "eventTypes": [
    {
      "name": "act",
      "attributes": [
        {
          "name": "standing",
          "type": "string"
        }
      ]
    },
    {
      "name": "materialize",
      "attributes": [
        {
          "name": "standing",
          "type": "string"
        }
      ]
    },
    {
      "name": "verify",
      "attributes": [
        {
          "name": "standing",
          "type": "string"
        }
      ]
    }
  ],
  "objectTypes": [
    {
      "name": "episode",
      "attributes": []
    },
    {
      "name": "environment",
      "attributes": []
    },
    {
      "name": "capability",
      "attributes": []
    }
  ],
  "events": [
    {
      "id": "48eccd5b354c45ec9eb5ea254be94fe2",
      "type": "materialize",
      "time": "2026-08-08T17:48:51.294871+00:00",
      "attributes": [
        {
          "name": "standing",
          "value": "ALIVE"
        },
        {
          "name": "idempotency_key",
          "value": "2b8af3d6d9894562ad0f147ad08af7fb"
        },
        {
          "name": "post_state_digest",
          "value": "2cc33b89e86ff478f2e6163b77f337848f88fe68cb18c5c8553db5a02fe6689c"
        }
      ],
      "relationships": [
        {
          "objectId": "8692efc8872d407f9489b8413fe85269",
          "qualifier": "episode"
        },
        {
          "objectId": "urn:gymact:resource-flow:environment:39d9949703ed4d698359d736ce0e1e61",
          "qualifier": "environment"
        },
        {
          "objectId": "urn:gymact:operation:materialize",
          "qualifier": "capability"
        }
      ]
    },
    {
      "id": "225d7910d1f145cfb1fe72cbee4c5d6d",
      "type": "act",
      "time": "2026-08-08T17:48:51.295999+00:00",
      "attributes": [
        {
          "name": "standing",
          "value": "ALIVE"
        },
        {
          "name": "idempotency_key",
          "value": "adfe6133720543608036363653b95ccc"
        },
        {
          "name": "pre_state_digest",
          "value": "2cc33b89e86ff478f2e6163b77f337848f88fe68cb18c5c8553db5a02fe6689c"
        },
        {
          "name": "post_state_digest",
          "value": "51a37f17c34bb13c0a46c5955bfd3b4f021f0d694380757ada0103c493768859"
        }
      ],
      "relationships": [
        {
          "objectId": "8692efc8872d407f9489b8413fe85269",
          "qualifier": "episode"
        },
        {
          "objectId": "urn:gymact:resource-flow:environment:39d9949703ed4d698359d736ce0e1e61",
          "qualifier": "environment"
        },
        {
          "objectId": "urn:gymact:resource-flow:capability:burn_catalyst",
          "qualifier": "capability"
        }
      ]
    },
    {
      "id": "6ec2e33735b5442198571832eae18cee",
      "type": "verify",
      "time": "2026-08-08T17:48:51.296446+00:00",
      "attributes": [
        {
          "name": "standing",
          "value": "ALIVE"
        },
        {
          "name": "idempotency_key",
          "value": "adfe6133720543608036363653b95ccc"
        },
        {
          "name": "pre_state_digest",
          "value": "2cc33b89e86ff478f2e6163b77f337848f88fe68cb18c5c8553db5a02fe6689c"
        },
        {
          "name": "post_state_digest",
          "value": "51a37f17c34bb13c0a46c5955bfd3b4f021f0d694380757ada0103c493768859"
        },
        {
          "name": "verification_id",
          "value": "ee0a600d99ba4febace6d82933b22814"
        }
      ],
      "relationships": [
        {
          "objectId": "8692efc8872d407f9489b8413fe85269",
          "qualifier": "episode"
        },
        {
          "objectId": "urn:gymact:resource-flow:environment:39d9949703ed4d698359d736ce0e1e61",
          "qualifier": "environment"
        },
        {
          "objectId": "urn:gymact:resource-flow:capability:burn_catalyst",
          "qualifier": "capability"
        }
      ]
    }
  ],
  "objects": [
    {
      "id": "8692efc8872d407f9489b8413fe85269",
      "type": "episode",
      "attributes": []
    },
    {
      "id": "urn:gymact:resource-flow:environment:39d9949703ed4d698359d736ce0e1e61",
      "type": "environment",
      "attributes": []
    },
    {
      "id": "urn:gymact:operation:materialize",
      "type": "capability",
      "attributes": []
    },
    {
      "id": "urn:gymact:resource-flow:capability:burn_catalyst",
      "type": "capability",
      "attributes": []
    }
  ]
}