{"eventTypes":[{"attributes":[{"name":"standing","type":"string"}],"name":"act"},{"attributes":[{"name":"standing","type":"string"}],"name":"materialize"},{"attributes":[{"name":"standing","type":"string"}],"name":"verify"},{"attributes":[{"name":"passed","type":"string"}],"name":"verify_goal_consequence"}],"events":[{"attributes":[{"name":"standing","value":"ALIVE"},{"name":"idempotency_key","value":"e2bcf204563a44f2819f524668f99d38"},{"name":"post_state_digest","value":"2cc33b89e86ff478f2e6163b77f337848f88fe68cb18c5c8553db5a02fe6689c"}],"id":"24ec749944474ab589e3764e8d986071","relationships":[{"objectId":"22aba5cc98824bc0bc8007b7c4a285d0","qualifier":"episode"},{"objectId":"urn:gymact:resource-flow:environment:d82f1416a7414fd192c2226ba78645cc","qualifier":"environment"},{"objectId":"urn:gymact:operation:materialize","qualifier":"capability"}],"time":"2026-08-08T21:48:52.694135+00:00","type":"materialize"},{"attributes":[{"name":"standing","value":"ALIVE"},{"name":"authority_ref","value":"urn:autofde-lab:level4-crown-authority"},{"name":"idempotency_key","value":"a36cd24f723741bd8e786fc11b2e248d"},{"name":"pre_state_digest","value":"2cc33b89e86ff478f2e6163b77f337848f88fe68cb18c5c8553db5a02fe6689c"},{"name":"post_state_digest","value":"51a37f17c34bb13c0a46c5955bfd3b4f021f0d694380757ada0103c493768859"}],"id":"3973a684075e4e70b5bcb2952337e50c","relationships":[{"objectId":"22aba5cc98824bc0bc8007b7c4a285d0","qualifier":"episode"},{"objectId":"urn:gymact:resource-flow:environment:d82f1416a7414fd192c2226ba78645cc","qualifier":"environment"},{"objectId":"urn:gymact:resource-flow:capability:burn_catalyst","qualifier":"capability"}],"time":"2026-08-08T21:48:52.694860+00:00","type":"act"},{"attributes":[{"name":"standing","value":"ALIVE"},{"name":"authority_ref","value":"urn:autofde-lab:level4-crown-authority"},{"name":"idempotency_key","value":"a36cd24f723741bd8e786fc11b2e248d"},{"name":"pre_state_digest","value":"2cc33b89e86ff478f2e6163b77f337848f88fe68cb18c5c8553db5a02fe6689c"},{"name":"post_state_digest","value":"51a37f17c34bb13c0a46c5955bfd3b4f021f0d694380757ada0103c493768859"},{"name":"verification_id","value":"14747d46613341879dc6f983811570b5"}],"id":"2e0bffbc3d7c4f439a3445b152f68f0b","relationships":[{"objectId":"22aba5cc98824bc0bc8007b7c4a285d0","qualifier":"episode"},{"objectId":"urn:gymact:resource-flow:environment:d82f1416a7414fd192c2226ba78645cc","qualifier":"environment"},{"objectId":"urn:gymact:resource-flow:capability:burn_catalyst","qualifier":"capability"}],"time":"2026-08-08T21:48:52.695232+00:00","type":"verify"},{"attributes":[{"name":"passed","value":"True"},{"name":"verification_id","value":"b4921bfc4354454bbbbe483035f9660b"},{"name":"state_digest","value":"51a37f17c34bb13c0a46c5955bfd3b4f021f0d694380757ada0103c493768859"},{"name":"expected_digest","value":"05dcaf409455262903ba5212629c8b86d20188a076e412c1c9970b644bf1e99c"},{"name":"observed_digest","value":"29832a192e8c40b9155145495ca109e99bea04c9d4280213c18a38315f5840bd"}],"id":"goal-verification:b4921bfc4354454bbbbe483035f9660b","relationships":[{"objectId":"22aba5cc98824bc0bc8007b7c4a285d0","qualifier":"episode"}],"time":"2026-08-08T21:48:52.695644+00:00","type":"verify_goal_consequence"}],"objectTypes":[{"attributes":[],"name":"episode"},{"attributes":[],"name":"environment"},{"attributes":[],"name":"capability"}],"objects":[{"attributes":[],"id":"22aba5cc98824bc0bc8007b7c4a285d0","type":"episode"},{"attributes":[],"id":"urn:gymact:resource-flow:environment:d82f1416a7414fd192c2226ba78645cc","type":"environment"},{"attributes":[],"id":"urn:gymact:operation:materialize","type":"capability"},{"attributes":[],"id":"urn:gymact:resource-flow:capability:burn_catalyst","type":"capability"}]}