{"eventTypes":[{"attributes":[{"name":"standing","type":"string"}],"name":"act"},{"attributes":[{"name":"standing","type":"string"}],"name":"materialize"},{"attributes":[{"name":"standing","type":"string"}],"name":"teardown"}],"events":[{"attributes":[{"name":"standing","value":"ALIVE"},{"name":"idempotency_key","value":"60b1f9086a91426099b6cea3b1ab5c44"},{"name":"post_state_digest","value":"0856c7566f616f763b31de1db4c2b0ca7293c283e2b8384f5eaf8ab3e854cf38"}],"id":"71f06e2c117d4d539e19b2af506bd576","relationships":[{"objectId":"618c5da39e15416c911513f7b8082cc8","qualifier":"episode"},{"objectId":"urn:gymact:discovered:environment:cd71c9dc64b24986a9a4d63890b1601a","qualifier":"environment"},{"objectId":"urn:gymact:operation:materialize","qualifier":"capability"}],"time":"2026-08-07T21:10:23.880646+00:00","type":"materialize"},{"attributes":[{"name":"standing","value":"ALIVE"},{"name":"reason","value":"solved=True returncode=0 timed_out=False stderr=''"},{"name":"idempotency_key","value":"b7b5777c69524b08b708160714b318d9"},{"name":"pre_state_digest","value":"0856c7566f616f763b31de1db4c2b0ca7293c283e2b8384f5eaf8ab3e854cf38"},{"name":"post_state_digest","value":"ce87f8a317ce2a9a3bf74e99dc8452fc0fd6c522616643b443dce8b7e85fc88b"}],"id":"308ba3bc9c3840c59a46700748adb3e9","relationships":[{"objectId":"618c5da39e15416c911513f7b8082cc8","qualifier":"episode"},{"objectId":"urn:gymact:discovered:environment:cd71c9dc64b24986a9a4d63890b1601a","qualifier":"environment"},{"objectId":"urn:gymact:discovered:capability:run","qualifier":"capability"}],"time":"2026-08-07T21:10:23.918777+00:00","type":"act"},{"attributes":[{"name":"standing","value":"ALIVE"},{"name":"pre_state_digest","value":"ce87f8a317ce2a9a3bf74e99dc8452fc0fd6c522616643b443dce8b7e85fc88b"}],"id":"2f55bad9238b4c13989e07b0095b46b6","relationships":[{"objectId":"618c5da39e15416c911513f7b8082cc8","qualifier":"episode"},{"objectId":"urn:gymact:discovered:environment:cd71c9dc64b24986a9a4d63890b1601a","qualifier":"environment"},{"objectId":"urn:gymact:operation:teardown","qualifier":"capability"}],"time":"2026-08-07T21:10:23.919133+00:00","type":"teardown"}],"objectTypes":[{"attributes":[],"name":"episode"},{"attributes":[],"name":"environment"},{"attributes":[],"name":"capability"}],"objects":[{"attributes":[],"id":"618c5da39e15416c911513f7b8082cc8","type":"episode"},{"attributes":[],"id":"urn:gymact:discovered:environment:cd71c9dc64b24986a9a4d63890b1601a","type":"environment"},{"attributes":[],"id":"urn:gymact:discovered:capability:run","type":"capability"},{"attributes":[],"id":"urn:gymact:operation:materialize","type":"capability"},{"attributes":[],"id":"urn:gymact:operation:teardown","type":"capability"}]}
