{"eventTypes":[{"attributes":[{"name":"standing","type":"string"}],"name":"act"},{"attributes":[{"name":"standing","type":"string"}],"name":"materialize"},{"attributes":[{"name":"standing","type":"string"}],"name":"verify"},{"attributes":[{"name":"passed","type":"string"}],"name":"verify_goal_consequence"}],"events":[{"attributes":[{"name":"standing","value":"ALIVE"},{"name":"idempotency_key","value":"26b9a409f7524fa4aeb27a4d23dc0699"},{"name":"post_state_digest","value":"26071527a12146b1a953d528ba6827aec426b12254cb4a27d400219d990ddd72"}],"id":"d9594bcff2bf486cbbc0efefb7510cc6","relationships":[{"objectId":"241b9b14466e44c4937117ac1a32fa26","qualifier":"episode"},{"objectId":"urn:gymact:resource-flow:environment:0c5f56783663465e81a19c4ed80ed71c","qualifier":"environment"},{"objectId":"urn:gymact:operation:materialize","qualifier":"capability"}],"time":"2026-08-08T20:21:20.277461+00:00","type":"materialize"},{"attributes":[{"name":"standing","value":"ALIVE"},{"name":"authority_ref","value":"urn:autofde-lab:level4-crown-authority"},{"name":"idempotency_key","value":"e47d747cdc1f442ba65e3d960b477289"},{"name":"pre_state_digest","value":"26071527a12146b1a953d528ba6827aec426b12254cb4a27d400219d990ddd72"},{"name":"post_state_digest","value":"6491cfccc6bd4a79f61fe9738ba7d4b7bfb81e64d63e539119aa85d81c7187eb"}],"id":"1ccbfd1319144c9ca49e1d35bd1adee0","relationships":[{"objectId":"241b9b14466e44c4937117ac1a32fa26","qualifier":"episode"},{"objectId":"urn:gymact:resource-flow:environment:0c5f56783663465e81a19c4ed80ed71c","qualifier":"environment"},{"objectId":"urn:gymact:resource-flow:capability:mine","qualifier":"capability"}],"time":"2026-08-08T20:21:20.278242+00:00","type":"act"},{"attributes":[{"name":"standing","value":"ALIVE"},{"name":"authority_ref","value":"urn:autofde-lab:level4-crown-authority"},{"name":"idempotency_key","value":"e47d747cdc1f442ba65e3d960b477289"},{"name":"pre_state_digest","value":"26071527a12146b1a953d528ba6827aec426b12254cb4a27d400219d990ddd72"},{"name":"post_state_digest","value":"6491cfccc6bd4a79f61fe9738ba7d4b7bfb81e64d63e539119aa85d81c7187eb"},{"name":"verification_id","value":"abd8d3f2b7a743af92c33db4cceff308"}],"id":"c8812406e1554ea3b33b78a86a2b2d78","relationships":[{"objectId":"241b9b14466e44c4937117ac1a32fa26","qualifier":"episode"},{"objectId":"urn:gymact:resource-flow:environment:0c5f56783663465e81a19c4ed80ed71c","qualifier":"environment"},{"objectId":"urn:gymact:resource-flow:capability:mine","qualifier":"capability"}],"time":"2026-08-08T20:21:20.278672+00:00","type":"verify"},{"attributes":[{"name":"standing","value":"ALIVE"},{"name":"authority_ref","value":"urn:autofde-lab:level4-crown-authority"},{"name":"idempotency_key","value":"eaf60cfa9fba40268a3520cd86b292e4"},{"name":"pre_state_digest","value":"6491cfccc6bd4a79f61fe9738ba7d4b7bfb81e64d63e539119aa85d81c7187eb"},{"name":"post_state_digest","value":"5a8797367829fad909d452ddefcb1b15c52094a3ab86d973a8baf738b482c971"}],"id":"272bf1cb213d4014b87aecf00df9eba6","relationships":[{"objectId":"241b9b14466e44c4937117ac1a32fa26","qualifier":"episode"},{"objectId":"urn:gymact:resource-flow:environment:0c5f56783663465e81a19c4ed80ed71c","qualifier":"environment"},{"objectId":"urn:gymact:resource-flow:capability:refine","qualifier":"capability"}],"time":"2026-08-08T20:21:20.279171+00:00","type":"act"},{"attributes":[{"name":"standing","value":"ALIVE"},{"name":"authority_ref","value":"urn:autofde-lab:level4-crown-authority"},{"name":"idempotency_key","value":"eaf60cfa9fba40268a3520cd86b292e4"},{"name":"pre_state_digest","value":"6491cfccc6bd4a79f61fe9738ba7d4b7bfb81e64d63e539119aa85d81c7187eb"},{"name":"post_state_digest","value":"5a8797367829fad909d452ddefcb1b15c52094a3ab86d973a8baf738b482c971"},{"name":"verification_id","value":"078e9750a4f4488d97a4f223fd17a614"}],"id":"47f1e9bac7644757a33d3d032fb6f613","relationships":[{"objectId":"241b9b14466e44c4937117ac1a32fa26","qualifier":"episode"},{"objectId":"urn:gymact:resource-flow:environment:0c5f56783663465e81a19c4ed80ed71c","qualifier":"environment"},{"objectId":"urn:gymact:resource-flow:capability:refine","qualifier":"capability"}],"time":"2026-08-08T20:21:20.279548+00:00","type":"verify"},{"attributes":[{"name":"standing","value":"ALIVE"},{"name":"authority_ref","value":"urn:autofde-lab:level4-crown-authority"},{"name":"idempotency_key","value":"a3ed8c5ec612460c8405a355f67f959c"},{"name":"pre_state_digest","value":"5a8797367829fad909d452ddefcb1b15c52094a3ab86d973a8baf738b482c971"},{"name":"post_state_digest","value":"b6ca8908985aa43fba4f69d43df78b6b61984719f402cdb79d92941dfbd68b5d"}],"id":"36d152b688c34cb4b078134ce82a6e7f","relationships":[{"objectId":"241b9b14466e44c4937117ac1a32fa26","qualifier":"episode"},{"objectId":"urn:gymact:resource-flow:environment:0c5f56783663465e81a19c4ed80ed71c","qualifier":"environment"},{"objectId":"urn:gymact:resource-flow:capability:assemble","qualifier":"capability"}],"time":"2026-08-08T20:21:20.279995+00:00","type":"act"},{"attributes":[{"name":"standing","value":"ALIVE"},{"name":"authority_ref","value":"urn:autofde-lab:level4-crown-authority"},{"name":"idempotency_key","value":"a3ed8c5ec612460c8405a355f67f959c"},{"name":"pre_state_digest","value":"5a8797367829fad909d452ddefcb1b15c52094a3ab86d973a8baf738b482c971"},{"name":"post_state_digest","value":"b6ca8908985aa43fba4f69d43df78b6b61984719f402cdb79d92941dfbd68b5d"},{"name":"verification_id","value":"da1f0b1039dc4491a5be17e9b9fcfa42"}],"id":"55f806045caa47da9536636a0178bca3","relationships":[{"objectId":"241b9b14466e44c4937117ac1a32fa26","qualifier":"episode"},{"objectId":"urn:gymact:resource-flow:environment:0c5f56783663465e81a19c4ed80ed71c","qualifier":"environment"},{"objectId":"urn:gymact:resource-flow:capability:assemble","qualifier":"capability"}],"time":"2026-08-08T20:21:20.280301+00:00","type":"verify"},{"attributes":[{"name":"standing","value":"ALIVE"},{"name":"authority_ref","value":"urn:autofde-lab:level4-crown-authority"},{"name":"idempotency_key","value":"b8304eb48e0a4adba498e7737e17c5dd"},{"name":"pre_state_digest","value":"b6ca8908985aa43fba4f69d43df78b6b61984719f402cdb79d92941dfbd68b5d"},{"name":"post_state_digest","value":"a4ca95551a3e36d79f529af08329fcdf4328ec0dfa806e84d2e330d53dd47ca9"}],"id":"507fe206e29a4432a3a81f909e0f7726","relationships":[{"objectId":"241b9b14466e44c4937117ac1a32fa26","qualifier":"episode"},{"objectId":"urn:gymact:resource-flow:environment:0c5f56783663465e81a19c4ed80ed71c","qualifier":"environment"},{"objectId":"urn:gymact:resource-flow:capability:burn_catalyst","qualifier":"capability"}],"time":"2026-08-08T20:21:20.280699+00:00","type":"act"},{"attributes":[{"name":"standing","value":"ALIVE"},{"name":"authority_ref","value":"urn:autofde-lab:level4-crown-authority"},{"name":"idempotency_key","value":"b8304eb48e0a4adba498e7737e17c5dd"},{"name":"pre_state_digest","value":"b6ca8908985aa43fba4f69d43df78b6b61984719f402cdb79d92941dfbd68b5d"},{"name":"post_state_digest","value":"a4ca95551a3e36d79f529af08329fcdf4328ec0dfa806e84d2e330d53dd47ca9"},{"name":"verification_id","value":"d2763b9d0bd74b43aa8f41fa6e2b96e3"}],"id":"19bec456263f471381d4ed7c762ae84d","relationships":[{"objectId":"241b9b14466e44c4937117ac1a32fa26","qualifier":"episode"},{"objectId":"urn:gymact:resource-flow:environment:0c5f56783663465e81a19c4ed80ed71c","qualifier":"environment"},{"objectId":"urn:gymact:resource-flow:capability:burn_catalyst","qualifier":"capability"}],"time":"2026-08-08T20:21:20.280974+00:00","type":"verify"},{"attributes":[{"name":"passed","value":"True"},{"name":"verification_id","value":"2d690348f7df4e2eb5f1a60038386f01"},{"name":"state_digest","value":"a4ca95551a3e36d79f529af08329fcdf4328ec0dfa806e84d2e330d53dd47ca9"},{"name":"expected_digest","value":"05dcaf409455262903ba5212629c8b86d20188a076e412c1c9970b644bf1e99c"},{"name":"observed_digest","value":"bdfa798ca70f120268453caa80f0c521b3fd56cc0b5d0099ec16b691632263f3"}],"id":"goal-verification:2d690348f7df4e2eb5f1a60038386f01","relationships":[{"objectId":"241b9b14466e44c4937117ac1a32fa26","qualifier":"episode"}],"time":"2026-08-08T20:21:20.281356+00:00","type":"verify_goal_consequence"}],"objectTypes":[{"attributes":[],"name":"episode"},{"attributes":[],"name":"environment"},{"attributes":[],"name":"capability"}],"objects":[{"attributes":[],"id":"241b9b14466e44c4937117ac1a32fa26","type":"episode"},{"attributes":[],"id":"urn:gymact:resource-flow:environment:0c5f56783663465e81a19c4ed80ed71c","type":"environment"},{"attributes":[],"id":"urn:gymact:operation:materialize","type":"capability"},{"attributes":[],"id":"urn:gymact:resource-flow:capability:assemble","type":"capability"},{"attributes":[],"id":"urn:gymact:resource-flow:capability:burn_catalyst","type":"capability"},{"attributes":[],"id":"urn:gymact:resource-flow:capability:mine","type":"capability"},{"attributes":[],"id":"urn:gymact:resource-flow:capability:refine","type":"capability"}]}