{"eventTypes":[{"attributes":[{"name":"standing","type":"string"}],"name":"act"},{"attributes":[{"name":"standing","type":"string"}],"name":"materialize"},{"attributes":[{"name":"standing","type":"string"}],"name":"teardown"}],"events":[{"attributes":[{"name":"standing","value":"ALIVE"},{"name":"idempotency_key","value":"6f1da299a2bc4021a5f365ef4abce053"},{"name":"post_state_digest","value":"64a89acad4b3ce1456109012af2f9f2aeb180a32fee77d14e685d634254fb1cb"}],"id":"ce33e77cc68a4eee9d8483f9b70eb3b0","relationships":[{"objectId":"97dd2805a070456dbc5a7437d5ad0ced","qualifier":"episode"},{"objectId":"urn:gymact:cube-counter:environment:2e0c0ebddd2341328938b264c24cfa6f","qualifier":"environment"},{"objectId":"urn:gymact:operation:materialize","qualifier":"capability"}],"time":"2026-08-07T20:34:06.228287+00:00","type":"materialize"},{"attributes":[{"name":"standing","value":"ALIVE"},{"name":"idempotency_key","value":"d5ae22ce2d604c7b9a69b2a5eef3eb6c"},{"name":"pre_state_digest","value":"64a89acad4b3ce1456109012af2f9f2aeb180a32fee77d14e685d634254fb1cb"},{"name":"post_state_digest","value":"934826282eaffc8211520e0f576a1980012c17113f269810573ccf9b5de1d668"}],"id":"6c9a0806d1a84069a94f1c0527b6ea34","relationships":[{"objectId":"97dd2805a070456dbc5a7437d5ad0ced","qualifier":"episode"},{"objectId":"urn:gymact:cube-counter:environment:2e0c0ebddd2341328938b264c24cfa6f","qualifier":"environment"},{"objectId":"urn:gymact:cube-counter:capability:increment","qualifier":"capability"}],"time":"2026-08-07T20:34:06.228660+00:00","type":"act"},{"attributes":[{"name":"standing","value":"ALIVE"},{"name":"idempotency_key","value":"9fe108a23f0a4c588826122faac02e22"},{"name":"pre_state_digest","value":"934826282eaffc8211520e0f576a1980012c17113f269810573ccf9b5de1d668"},{"name":"post_state_digest","value":"a2d450be84d65a0cab898244f5eeaa3db65ee53ff42b76eb33039fec40e5e522"}],"id":"39f2268c549d412aa27d212b79081eeb","relationships":[{"objectId":"97dd2805a070456dbc5a7437d5ad0ced","qualifier":"episode"},{"objectId":"urn:gymact:cube-counter:environment:2e0c0ebddd2341328938b264c24cfa6f","qualifier":"environment"},{"objectId":"urn:gymact:cube-counter:capability:increment","qualifier":"capability"}],"time":"2026-08-07T20:34:06.228755+00:00","type":"act"},{"attributes":[{"name":"standing","value":"ALIVE"},{"name":"idempotency_key","value":"527bc890fab74457903d6e6b12c040bf"},{"name":"pre_state_digest","value":"a2d450be84d65a0cab898244f5eeaa3db65ee53ff42b76eb33039fec40e5e522"},{"name":"post_state_digest","value":"8151d9f7ab422c7d0b37ac2d505b2aec0c33a78bea07b9fa2ee5e663f0855eb6"}],"id":"6f7b2bea64b044fd9cc0ce83952b91ac","relationships":[{"objectId":"97dd2805a070456dbc5a7437d5ad0ced","qualifier":"episode"},{"objectId":"urn:gymact:cube-counter:environment:2e0c0ebddd2341328938b264c24cfa6f","qualifier":"environment"},{"objectId":"urn:gymact:cube-counter:capability:increment","qualifier":"capability"}],"time":"2026-08-07T20:34:06.228835+00:00","type":"act"},{"attributes":[{"name":"standing","value":"ALIVE"},{"name":"pre_state_digest","value":"8151d9f7ab422c7d0b37ac2d505b2aec0c33a78bea07b9fa2ee5e663f0855eb6"}],"id":"9b9db7c7f9d64c8fb16301c6fb367fa1","relationships":[{"objectId":"97dd2805a070456dbc5a7437d5ad0ced","qualifier":"episode"},{"objectId":"urn:gymact:cube-counter:environment:2e0c0ebddd2341328938b264c24cfa6f","qualifier":"environment"},{"objectId":"urn:gymact:operation:teardown","qualifier":"capability"}],"time":"2026-08-07T20:34:06.228884+00:00","type":"teardown"}],"objectTypes":[{"attributes":[],"name":"episode"},{"attributes":[],"name":"environment"},{"attributes":[],"name":"capability"}],"objects":[{"attributes":[],"id":"97dd2805a070456dbc5a7437d5ad0ced","type":"episode"},{"attributes":[],"id":"urn:gymact:cube-counter:environment:2e0c0ebddd2341328938b264c24cfa6f","type":"environment"},{"attributes":[],"id":"urn:gymact:cube-counter:capability:increment","type":"capability"},{"attributes":[],"id":"urn:gymact:operation:materialize","type":"capability"},{"attributes":[],"id":"urn:gymact:operation:teardown","type":"capability"}]}
