{"eventTypes":[{"attributes":[{"name":"standing","type":"string"}],"name":"act"},{"attributes":[{"name":"standing","type":"string"}],"name":"materialize"},{"attributes":[{"name":"standing","type":"string"}],"name":"teardown"}],"events":[{"attributes":[{"name":"standing","value":"ALIVE"},{"name":"idempotency_key","value":"34ef934d3d144532a914dd72d9bc2f5f"},{"name":"post_state_digest","value":"322808e7af3dffe8c54f65facf6b107562ae23ee7644c0fa06cb3a06c3003671"}],"id":"e681f820505446cfbbae70b5e76bcca9","relationships":[{"objectId":"290340bfdd3746fb8e1685ccac9a5ec3","qualifier":"episode"},{"objectId":"urn:gymact:terraform-plan:environment:99c74fd6710b4a1bbaabb19688c7d7ad","qualifier":"environment"},{"objectId":"urn:gymact:operation:materialize","qualifier":"capability"}],"time":"2026-08-07T23:43:17.442563+00:00","type":"materialize"},{"attributes":[{"name":"standing","value":"ALIVE"},{"name":"idempotency_key","value":"f2143d9f9de84dfb84ebd5b20b221575"},{"name":"pre_state_digest","value":"322808e7af3dffe8c54f65facf6b107562ae23ee7644c0fa06cb3a06c3003671"},{"name":"post_state_digest","value":"535ab023048cfdfa7145a792b31e3cecfcf05790143e832a22ca61deb56169b3"}],"id":"66e0b34ed95f4c549833ec502116e82a","relationships":[{"objectId":"290340bfdd3746fb8e1685ccac9a5ec3","qualifier":"episode"},{"objectId":"urn:gymact:terraform-plan:environment:99c74fd6710b4a1bbaabb19688c7d7ad","qualifier":"environment"},{"objectId":"urn:gymact:terraform-plan:capability:plan","qualifier":"capability"}],"time":"2026-08-07T23:43:18.335417+00:00","type":"act"},{"attributes":[{"name":"standing","value":"ALIVE"},{"name":"pre_state_digest","value":"535ab023048cfdfa7145a792b31e3cecfcf05790143e832a22ca61deb56169b3"}],"id":"903563b78ec14e9a91a2f49523c15302","relationships":[{"objectId":"290340bfdd3746fb8e1685ccac9a5ec3","qualifier":"episode"},{"objectId":"urn:gymact:terraform-plan:environment:99c74fd6710b4a1bbaabb19688c7d7ad","qualifier":"environment"},{"objectId":"urn:gymact:operation:teardown","qualifier":"capability"}],"time":"2026-08-07T23:43:18.335833+00:00","type":"teardown"}],"objectTypes":[{"attributes":[],"name":"episode"},{"attributes":[],"name":"environment"},{"attributes":[],"name":"capability"}],"objects":[{"attributes":[],"id":"290340bfdd3746fb8e1685ccac9a5ec3","type":"episode"},{"attributes":[],"id":"urn:gymact:terraform-plan:environment:99c74fd6710b4a1bbaabb19688c7d7ad","type":"environment"},{"attributes":[],"id":"urn:gymact:operation:materialize","type":"capability"},{"attributes":[],"id":"urn:gymact:operation:teardown","type":"capability"},{"attributes":[],"id":"urn:gymact:terraform-plan:capability:plan","type":"capability"}]}