{"eventTypes":[{"attributes":[{"name":"standing","type":"string"}],"name":"act"},{"attributes":[{"name":"standing","type":"string"}],"name":"materialize"},{"attributes":[{"name":"standing","type":"string"}],"name":"teardown"}],"events":[{"attributes":[{"name":"standing","value":"ALIVE"},{"name":"idempotency_key","value":"42effac82af341f68dbbdb513b32d360"},{"name":"post_state_digest","value":"0551060a3a9fab3abe1d7939663b4a3e43fbe3a5803afa42eeaba7bf51c96d47"}],"id":"0e6f882ccb2c47a599cb47fd909aba22","relationships":[{"objectId":"39511061178b4cc28bc83254d2760f9e","qualifier":"episode"},{"objectId":"urn:gymact:cube-container-counter:environment:bb797db1ff6e46b89117f160c8aea041","qualifier":"environment"},{"objectId":"urn:gymact:operation:materialize","qualifier":"capability"}],"time":"2026-08-07T20:41:56.287528+00:00","type":"materialize"},{"attributes":[{"name":"standing","value":"ALIVE"},{"name":"idempotency_key","value":"87224cd4183045c8b6aa45d5361a7954"},{"name":"pre_state_digest","value":"0551060a3a9fab3abe1d7939663b4a3e43fbe3a5803afa42eeaba7bf51c96d47"},{"name":"post_state_digest","value":"e5bbcd33dbb7d9fb194a0791c9de591f23a6ae65e21fca57d68fab3b57e7d19e"}],"id":"fd3f134119194ff29aa1d4ba16610680","relationships":[{"objectId":"39511061178b4cc28bc83254d2760f9e","qualifier":"episode"},{"objectId":"urn:gymact:cube-container-counter:environment:bb797db1ff6e46b89117f160c8aea041","qualifier":"environment"},{"objectId":"urn:gymact:cube-container-counter:capability:increment","qualifier":"capability"}],"time":"2026-08-07T20:41:56.287787+00:00","type":"act"},{"attributes":[{"name":"standing","value":"ALIVE"},{"name":"idempotency_key","value":"0280264e16f3491abb6f647ac7652e18"},{"name":"pre_state_digest","value":"e5bbcd33dbb7d9fb194a0791c9de591f23a6ae65e21fca57d68fab3b57e7d19e"},{"name":"post_state_digest","value":"75c660612a0980d9cf032e10c275f44bef21244d105058f2b6eebc7aff108384"}],"id":"05b14c5602034c2c9b6e33b1c8475c29","relationships":[{"objectId":"39511061178b4cc28bc83254d2760f9e","qualifier":"episode"},{"objectId":"urn:gymact:cube-container-counter:environment:bb797db1ff6e46b89117f160c8aea041","qualifier":"environment"},{"objectId":"urn:gymact:cube-container-counter:capability:increment","qualifier":"capability"}],"time":"2026-08-07T20:41:56.287899+00:00","type":"act"},{"attributes":[{"name":"standing","value":"ALIVE"},{"name":"idempotency_key","value":"dbc9a0b594c841e889294e8b6fe5d954"},{"name":"pre_state_digest","value":"75c660612a0980d9cf032e10c275f44bef21244d105058f2b6eebc7aff108384"},{"name":"post_state_digest","value":"3eff465ccffa21d9cb15626133018666e546dcdf256628529f97d00e7ce2cd6b"}],"id":"06d949c0d2274c8fa72fee887c96514a","relationships":[{"objectId":"39511061178b4cc28bc83254d2760f9e","qualifier":"episode"},{"objectId":"urn:gymact:cube-container-counter:environment:bb797db1ff6e46b89117f160c8aea041","qualifier":"environment"},{"objectId":"urn:gymact:cube-container-counter:capability:increment","qualifier":"capability"}],"time":"2026-08-07T20:41:56.287992+00:00","type":"act"},{"attributes":[{"name":"standing","value":"ALIVE"},{"name":"idempotency_key","value":"06ba9bd99282421289a362e2ad4ae940"},{"name":"pre_state_digest","value":"3eff465ccffa21d9cb15626133018666e546dcdf256628529f97d00e7ce2cd6b"},{"name":"post_state_digest","value":"71cf48db5cd6dbe64e93a6a84735e962062153b172579894c113a036ccc7a1cf"}],"id":"a2621abc29204f4cbedf628455572b4c","relationships":[{"objectId":"39511061178b4cc28bc83254d2760f9e","qualifier":"episode"},{"objectId":"urn:gymact:cube-container-counter:environment:bb797db1ff6e46b89117f160c8aea041","qualifier":"environment"},{"objectId":"urn:gymact:cube-container-counter:capability:decrement","qualifier":"capability"}],"time":"2026-08-07T20:41:56.288079+00:00","type":"act"},{"attributes":[{"name":"standing","value":"ALIVE"},{"name":"idempotency_key","value":"49f989007bc5483e9ba8c37c07084a13"},{"name":"pre_state_digest","value":"71cf48db5cd6dbe64e93a6a84735e962062153b172579894c113a036ccc7a1cf"},{"name":"post_state_digest","value":"b7039c67058510260072af57b7c1efe32c6934f7231839332e60741e32865212"}],"id":"ea83f861a56d4d99bf31b609030ccb3c","relationships":[{"objectId":"39511061178b4cc28bc83254d2760f9e","qualifier":"episode"},{"objectId":"urn:gymact:cube-container-counter:environment:bb797db1ff6e46b89117f160c8aea041","qualifier":"environment"},{"objectId":"urn:gymact:cube-container-counter:capability:increment","qualifier":"capability"}],"time":"2026-08-07T20:41:56.288159+00:00","type":"act"},{"attributes":[{"name":"standing","value":"ALIVE"},{"name":"pre_state_digest","value":"b7039c67058510260072af57b7c1efe32c6934f7231839332e60741e32865212"}],"id":"eea5f9047c694a39906730635ccc5890","relationships":[{"objectId":"39511061178b4cc28bc83254d2760f9e","qualifier":"episode"},{"objectId":"urn:gymact:cube-container-counter:environment:bb797db1ff6e46b89117f160c8aea041","qualifier":"environment"},{"objectId":"urn:gymact:operation:teardown","qualifier":"capability"}],"time":"2026-08-07T20:42:06.372564+00:00","type":"teardown"}],"objectTypes":[{"attributes":[],"name":"episode"},{"attributes":[],"name":"environment"},{"attributes":[],"name":"capability"}],"objects":[{"attributes":[],"id":"39511061178b4cc28bc83254d2760f9e","type":"episode"},{"attributes":[],"id":"urn:gymact:cube-container-counter:environment:bb797db1ff6e46b89117f160c8aea041","type":"environment"},{"attributes":[],"id":"urn:gymact:cube-container-counter:capability:decrement","type":"capability"},{"attributes":[],"id":"urn:gymact:cube-container-counter:capability:increment","type":"capability"},{"attributes":[],"id":"urn:gymact:operation:materialize","type":"capability"},{"attributes":[],"id":"urn:gymact:operation:teardown","type":"capability"}]}