{"eventTypes":[{"attributes":[{"name":"standing","type":"string"}],"name":"act"},{"attributes":[{"name":"standing","type":"string"}],"name":"materialize"},{"attributes":[{"name":"standing","type":"string"}],"name":"teardown"}],"events":[{"attributes":[{"name":"standing","value":"ALIVE"},{"name":"idempotency_key","value":"2e1b2434d15649598c4a472b9adf57d7"},{"name":"post_state_digest","value":"12c21760153ce82649f1ae656ed794cfa81e9b3ffd6b0ff8775722ee15639ded"}],"id":"738f2e9b93454b7eb7d0d2a3a7d18702","relationships":[{"objectId":"ec7ac7e3b38d4c3f89dc0dbbfb471fd4","qualifier":"episode"},{"objectId":"urn:gymact:discovered:environment:76cae4b26889427fb35a25288302fdcc","qualifier":"environment"},{"objectId":"urn:gymact:operation:materialize","qualifier":"capability"}],"time":"2026-08-07T21:02:12.220381+00:00","type":"materialize"},{"attributes":[{"name":"standing","value":"ALIVE"},{"name":"reason","value":"solved=True returncode=0"},{"name":"idempotency_key","value":"9be875387a6649499b779ebfeaf5475d"},{"name":"pre_state_digest","value":"12c21760153ce82649f1ae656ed794cfa81e9b3ffd6b0ff8775722ee15639ded"},{"name":"post_state_digest","value":"f9c705d2f92082b3b26b09a399018894d40a12ade8ac859f9fa2f62097c89b9a"}],"id":"919be33446764e2497ef598c2d56827d","relationships":[{"objectId":"ec7ac7e3b38d4c3f89dc0dbbfb471fd4","qualifier":"episode"},{"objectId":"urn:gymact:discovered:environment:76cae4b26889427fb35a25288302fdcc","qualifier":"environment"},{"objectId":"urn:gymact:discovered:capability:run","qualifier":"capability"}],"time":"2026-08-07T21:02:12.242902+00:00","type":"act"},{"attributes":[{"name":"standing","value":"ALIVE"},{"name":"pre_state_digest","value":"f9c705d2f92082b3b26b09a399018894d40a12ade8ac859f9fa2f62097c89b9a"}],"id":"16be37b7fead46858d13b4f5926c203a","relationships":[{"objectId":"ec7ac7e3b38d4c3f89dc0dbbfb471fd4","qualifier":"episode"},{"objectId":"urn:gymact:discovered:environment:76cae4b26889427fb35a25288302fdcc","qualifier":"environment"},{"objectId":"urn:gymact:operation:teardown","qualifier":"capability"}],"time":"2026-08-07T21:02:12.243267+00:00","type":"teardown"}],"objectTypes":[{"attributes":[],"name":"episode"},{"attributes":[],"name":"environment"},{"attributes":[],"name":"capability"}],"objects":[{"attributes":[],"id":"ec7ac7e3b38d4c3f89dc0dbbfb471fd4","type":"episode"},{"attributes":[],"id":"urn:gymact:discovered:environment:76cae4b26889427fb35a25288302fdcc","type":"environment"},{"attributes":[],"id":"urn:gymact:discovered:capability:run","type":"capability"},{"attributes":[],"id":"urn:gymact:operation:materialize","type":"capability"},{"attributes":[],"id":"urn:gymact:operation:teardown","type":"capability"}]}
